<?xml version="1.0" encoding="UTF-8"?>
<iob_response_root xmlns:xsi="http://www.w3.org/2001/XMLSchema-instance" xsi:noNamespaceSchemaLocation="getLaunchpointCase.xsd">
  <CaseId>0</CaseId>
  <ClientId>0</ClientId>
  <ISOIndicator>0</ISOIndicator>
  <Score>0</Score>
  <AccidentDate>2001-01-01</AccidentDate>
  <BenefitAmount>0</BenefitAmount>
  <FundingSource>FundingSource</FundingSource>
  <LOB>LOB</LOB>
  <State>State</State>
  <WorkComp>WorkComp</WorkComp>
  <CaseStatus>CaseStatus</CaseStatus>
  <CaseSource>CaseSource</CaseSource>
  <SkipDuplicateCheck>true</SkipDuplicateCheck>
  <InvalidAddress>true</InvalidAddress>
  <LifecycleDescription>LifecycleDescription</LifecycleDescription>
  <CloseReason>CloseReason</CloseReason>
  <VipIndicator>true</VipIndicator>
  <CreateDate>2001-01-01</CreateDate>
  <ModifyDate>2001-01-01</ModifyDate>
  <CreatedBy>CreatedBy</CreatedBy>
  <ModifyBy>ModifyBy</ModifyBy>
</iob_response_root>
